이름,성함,회신 여부,주소,전화번호
베스트365공인중개사사무소,국경일,Yes,경기 용인시 처인구 고림동208-3 1층,010-7939-2040
스타부동산공인중개사사무소,황금옥,Yes,경기도 용인시 처인구 포곡읍 둔전로47번길 11 8호,010-3723-2035
코끼리공인중개사사무소,이영희,No,"경기도 남양주시 진접읍 해밀예당1로 64,103호",010-7224-0140
1등공인중개사사무소,정재식,No,경기도 남양주시 화도읍 창현리 675-7,010-5215-3710
서울공인중개사사무소,이정훈,No,경기도 남양주시 화도읍 차산리 304,010-4750-8963
차산리는 황금의 땅 공인중개사사무소,김용현,No,"경기도 남양주시 화도읍 재재기로 68 화도읍 차산리208, 103호",010-9278-3837
이박사공인중개사 사무소,이은규,No,경기도 남양주시 화도읍 월산리 362-2,010-8943-5374
청구공인중개사사무소,홍덕만,No,"경기도 남양주시 화도읍 수레로 1157-1,상가 102호 (창현리,청구아파트)",010-5287-3733
신명중흥공인중개사사무소,허준,No,"경기도 남양주시 화도읍 비룡로 56-8,상가 102호(신명스카이뷰그린아파트)",010-2837-2709
대통공인중개사사무소,김연길,No,경기도 남양주시 화도읍 마석중앙로 85,010-3212-7337
행복부동산공인중개사사무소,백수현,No,경기도 남양주시 화도읍 마석우리 309-6 101호,010-4789-9005
북한강부동산,김교나,No,경기도 남양주시 화도읍 금남리 354-6 1층 101호,010-6361-4459
복담은공인중개사사무소,박미주,No,경기도 남양주시 화도읍 가곡리 279-2 가곡초등학교인근 대로변 1층,010-9060-9115
한남공인중개사사무소,유옥란,No,경기도 남양주시 화도읍 가곡로 35,010-2729-3191
전원공인중개사사무소,조기돈,No,경기도 남양주시 조안면 삼봉리 33-4,010-5037-4122
홍익공인중개사사무소,홍순희,No,경기도 남양주시 일패동 75-6 1층,010-8581-2000
우진부동산공인중개사사무소,신광호,No,경기도 남양주시 와부읍 율석리 791-1,010-9083-6552
부동산뉴스공인중개사,최광숙,No,"경기도 용인시
  수지구 대지로 18 104-1호(죽전동,대지빌딩)",010-8956-8018
지구촌공인중개사사무소,임광석,No,경기도 용인시 기흥구 보라동 455-5,010-6215-7010
이새공인중개사사무소,김희정,No,경기 용인시 수지구 고기동224-1 1층,010-3263-7854
데시앙세종공인중개사사무소,변미숙,No,경기 용인시 처인구 금령로12번길 50 (김량장동) 1층,010-7419-3355
황금공인중개사사무소,윤채은,No,경기도 용인시 처인구 김량장동 314 2호,010-2703-4988
부영공인중개사사무소,정애경,No,경기도 용인시 처인구 남사읍 북리 618,010-5778-3060
남사복공인중개사사무소,이숙희,No,"경기도 용인시 처인구 남사읍 경기동로 127,1층",010-6241-2174
하나인공인중개사사무소,이인영,No,경기 용인시 처인구 남사읍 처인성로 5,010-4471-4326
천사공인중개사사무소,김계화,No,경기 용인시 처인구 남사읍 봉명리387-5,010-2339-7006
명지공인중개사사무소,김광영,No,"경기도 용인시 처인구 명지로 15-4, 역북빌딩 1층",010-3341-7562
원주민공인중개사사무소,남영우,No,경기도 용인시 처인구 이동읍 천리 511-5 1층,010-2338-4690
우리마을공인중개사사무소,이선희,No,경기 용인시 처인구 포곡읍 삼계리479-17 1층,010-2272-5949
파인 공인중개사사무소,김재호,No,경기도 용인시 처인구 금령로 170 (마평동),010-9018-0866
행복 공인중개사사무소,김소영,No,경기도 용인시 처인구 이동읍 천리 584-65 105호,010-3561-5354
강남공인중개사사무소,신용규,No,경기 용인시 처인구 남사읍 아곡리513-1 104호,010-5342-9382
파인공인중개사사무소,김재호,No,경기도 용인시 처인구 마평동 634-3,010-9018-0866
그린공인중개사사무소,오흥도,No,경기 용인시 처인구 양지면 양지리110-3 나동 2호,010-8757-5950
다산공인중개사사무소,김기홍,No,경기도 용인시 처인구 원삼면 맹리 544-9,010-5185-4857
박이숙공인중개사사무소,박이숙,No,경기도 용인시 처인구 원삼면 두창리 1288-4 A동107호,010-2788-3880
뉴흙사랑공인중개사사무소,김소희,No,"경기도 용인시 처인구 금령로 191, 2층 205호 (마평동)",010-4844-7494
청파공인중개사사무소,이상훈,No,경기도 용인시 처인구 모현읍 능원리 16-12 102호,010-4073-4452
용인부동산,손태율,No,경기도 용인시 처인구 양지면 양지리 110-9 (양지면),010-3747-4945
스마트공인중개사사무소,신정섭,No,경기도 용인시 처인구 모현읍 왕산리 820,010-8871-2543
모현365공인중개사사무소,이동호,No,경기 용인시 처인구 모현읍 갈담리리332-6,010-2997-5006
풀무부동산공인중개사사무소,정익교,No,경기 용인시 처인구 포곡읍 마성리48-10 2층,010-3082-5313
스카이부동산중개법인(주),이종찬,No,경기도 용인시 수지구 신봉동 1034,010-4947-5500
나무공인중개사사무소,김수윤,No,경기도 용인시 처인구 포곡읍 포곡로118번길 51-13,010-3950-0086
고림힐스타공인중개사사무소,배진한,No,"경기 용인시 처인구 한터로 74,2층(고림동)",010-8450-8457
삼강공인중개사 사무소,김순창,No,경기도 이천시 대월면 사동리 347-152,010-8754-2161
이천시부동산공인중개사사무소,한명희,No,경기도 이천시 서희로72번길 17 1층,010-6364-5107
이성래공인중개사무소,이성래,No,경기도 이천시 창전동 150-7,010-5229-5110
코리아공인중개사사무소,정지흥,No,경기도 이천시 갈산동 656-4 갈산동 건강보험공단 옆,010-6346-7840
원스톱공인중개사사무소,박성순,No,경기도 이천시 부발읍 수정리 62-19,010-3738-8845
스피드공인중개사사무소,김채원,No,경기도 이천시 송정동 314 104호,010-2824-8842
이천토지공인중개사사무실,김말희,No,경기도 이천시 신둔면 수광리 538-1,010-3089-1378
홍박사 공인중개사 사무소,유성현,No,경기도 이천시 신둔면 수광리 137-2,010-8958-8928
신영공인중개사사무소,원신영,No,경기 여주시 점봉동444-13 가동 2호,010-7566-0080
유성공인중개사사무소,유성철,No,경기도 여주시 점봉동 162-5 1층(102호),010-7580-8244
아랫목공인중개사사무소,박상환,No,경기도 여주시 교동 76-4,010-5212-6931
우리아이파크부동산공인중개사사무소,이성희,No,기도 여주시 현암동 695,010-4789-6708
여주경기공인중개사사사무소,노창식,No,경기도 여주시 상동 292-1,010-2408-9411
유성공인중개사사무소,유성철,No,경기도 여주시 점봉동 162-5,010-7580-8244
여주역공인중개사,고현정,No,경기도 여주시 교동 237-3,010-7715-6307
나무공인중개사사무소,이희진,No,경기도 여주시 월송동 179-12,010-5227-3819